{
  "schema_version": "1.0.0",
  "reference_date": "2026-07-30",
  "requirements": [
    {"requirement_id":"SAFE-REQ-001","topic":"interesul superior","requirement_text":"Orice măsură privind copilul trebuie subordonată cu prioritate interesului său superior.","status":"LEGAL_REQUIREMENT_ROMANIA","legal_or_policy_basis":"Legea nr. 272/2004, forma consolidată","issuer":"Parlamentul României","exact_article_or_section":"art. 2 alin. (1), (3) și (6)","applies_to":["club când ia decizii care privesc copilul","personal","colaboratori"],"effective_date":"2005-01-01","last_verified":"2026-07-30","responsible_role":["conducerea clubului","antrenor"],"required_evidence":["decizie motivată","evaluare individuală"],"manual_implication":"Siguranța și demnitatea prevalează asupra rezultatului sportiv.","club_action":"Include criteriul în politici și în deciziile documentate.","uncertainty":"Aplicarea concretă depinde de tipul deciziei.","legal_review_required":true,"source_ids":["SRC-0009"]},
    {"requirement_id":"SAFE-REQ-002","topic":"opinia copilului","requirement_text":"Copilului capabil de discernământ i se asigură posibilitatea de a-și exprima opinia în problemele care îl privesc, potrivit vârstei și maturității.","status":"LEGAL_REQUIREMENT_ROMANIA","legal_or_policy_basis":"Legea nr. 272/2004, forma consolidată","issuer":"Parlamentul României","exact_article_or_section":"art. 29 alin. (1) și (4)","applies_to":["decizii ale clubului care privesc copilul"],"effective_date":"2005-01-01","last_verified":"2026-07-30","responsible_role":["conducerea clubului","responsabil safeguarding"],"required_evidence":["metodă de consultare adecvată vârstei"],"manual_implication":"Acordul părintelui nu elimină ascultarea opiniei copilului.","club_action":"Definește când și cum este ascultat copilul.","uncertainty":"Greutatea opiniei se apreciază contextual.","legal_review_required":true,"source_ids":["SRC-0009"]},
    {"requirement_id":"SAFE-REQ-003","topic":"protecția împotriva violenței","requirement_text":"Copilul este protejat împotriva abuzului, neglijării, exploatării și violenței inclusiv în mediul sportiv și online.","status":"LEGAL_REQUIREMENT_ROMANIA","legal_or_policy_basis":"Legea nr. 272/2004, forma consolidată","issuer":"Parlamentul României","exact_article_or_section":"art. 89 alin. (1)","applies_to":["orice copil","medii sportive","internet"],"effective_date":"2005-01-01","last_verified":"2026-07-30","responsible_role":["club","toți adulții"],"required_evidence":["politică","evaluări de risc","procedură de răspuns"],"manual_implication":"Protecția acoperă și violența verbală, emoțională și digitală.","club_action":"Previne, observă, raportează și răspunde proporțional.","uncertainty":"Încadrarea juridică a fiecărei conduite depinde de fapte.","legal_review_required":false,"source_ids":["SRC-0009"]},
    {"requirement_id":"SAFE-REQ-004","topic":"sesizarea suspiciunii","requirement_text":"Angajații instituțiilor publice sau private care intră profesional în contact cu copilul și suspectează abuz, neglijare, înstrăinare părintească ori rele tratamente sesizează de urgență DGASPC.","status":"LEGAL_REQUIREMENT_ROMANIA","legal_or_policy_basis":"Legea nr. 272/2004, forma consolidată la 2026-07-30","issuer":"Parlamentul României","exact_article_or_section":"art. 89 alin. (3)","applies_to":["angajați ai clubului care intră profesional în contact cu copii"],"effective_date":"2024-05-10","last_verified":"2026-07-30","responsible_role":["antrenor angajat","personal angajat"],"required_evidence":["ora sesizării","canalul folosit","notă factuală"],"manual_implication":"Antrenorul nu așteaptă dovada și nu investighează înainte de sesizare.","club_action":"Procedura internă nu poate bloca sesizarea legală.","uncertainty":"Statutul colaboratorilor neangajați cere analiză juridică distinctă; orice persoană poate sesiza potrivit alin. (2).","legal_review_required":true,"source_ids":["SRC-0009"]},
    {"requirement_id":"SAFE-REQ-005","topic":"integritate comportamentală","requirement_text":"Entitățile din educație fizică și sport sau cu activitate ce presupune contact direct cu copii solicită certificatul de integritate comportamentală persoanelor cu care încheie raporturi de muncă, voluntariat sau similare.","status":"LEGAL_REQUIREMENT_ROMANIA","legal_or_policy_basis":"Legea nr. 118/2019, forma consolidată după Legea nr. 38/2026","issuer":"Parlamentul României","exact_article_or_section":"art. 18 alin. (1)","applies_to":["cluburi sportive","angajați","voluntari","raporturi similare cu contact direct"],"effective_date":"2026-03-28","last_verified":"2026-07-30","responsible_role":["conducerea clubului","resurse umane"],"required_evidence":["verificare efectuată","acces restricționat","reverificare înainte de expirare"],"manual_implication":"Certificatul nu înlocuiește recrutarea sigură și supravegherea.","club_action":"Solicită documentul înaintea începerii raportului și gestionează-l conform protecției datelor.","uncertainty":"Încadrarea exactă a unor prestatori ocazionali trebuie verificată juridic.","legal_review_required":true,"source_ids":["SRC-0010"]},
    {"requirement_id":"SAFE-REQ-006","topic":"valabilitatea certificatului","requirement_text":"Certificatul de integritate comportamentală este valabil șase luni de la eliberare.","status":"LEGAL_REQUIREMENT_ROMANIA","legal_or_policy_basis":"Legea nr. 118/2019","issuer":"Parlamentul României","exact_article_or_section":"art. 16 alin. (3)","applies_to":["persoana verificată","entitatea solicitantă"],"effective_date":"2019-06-20","last_verified":"2026-07-30","responsible_role":["resurse umane"],"required_evidence":["data emiterii","data reverificării"],"manual_implication":"Checklistul de recrutare urmărește expirarea.","club_action":"Stabilește o reverificare documentată fără a păstra copii inutil.","uncertainty":"Data operațională se calculează pentru fiecare certificat emis.","legal_review_required":false,"source_ids":["SRC-0010"]},
    {"requirement_id":"SAFE-REQ-007","topic":"date și imagini","requirement_text":"Datele copiilor se prelucrează în scopuri determinate, cu minimizare, securitate și termen de păstrare justificat; imaginile necesită și analiza dreptului la propria imagine.","status":"LEGAL_REQUIREMENT_ROMANIA","legal_or_policy_basis":"Regulamentul (UE) 2016/679 și Codul civil","issuer":"Uniunea Europeană și Parlamentul României","exact_article_or_section":"GDPR art. 5–7; Cod civil art. 73–75","applies_to":["club operator de date","personal autorizat","furnizori"],"effective_date":"2018-05-25","last_verified":"2026-07-30","responsible_role":["conducerea clubului","responsabil protecția datelor"],"required_evidence":["scop","temei","informare","control acces","termen de ștergere"],"manual_implication":"Acordul parental nu este o formulă universală pentru orice prelucrare.","club_action":"Documentează temeiul și ascultă opinia copilului înainte de publicarea imaginilor.","uncertainty":"Temeiul exact diferă între analiză internă, obligație legală și publicare; necesită DPO/jurist.","legal_review_required":true,"source_ids":["SRC-0011","SRC-0012"]},
    {"requirement_id":"SAFE-REQ-008","topic":"numărul 119","requirement_text":"Numărul 119 este canalul național destinat raportării abuzului, neglijării, exploatării și altor forme de violență asupra copilului.","status":"LEGAL_REQUIREMENT_ROMANIA","legal_or_policy_basis":"OUG nr. 105/2021 și serviciul oficial ANPDCA","issuer":"Guvernul României","exact_article_or_section":"OUG 105/2021, art. 6; pagina oficială a serviciului 119","applies_to":["orice persoană care semnalează o situație privind un copil"],"effective_date":"2022-01-01","last_verified":"2026-07-30","responsible_role":["orice persoană","DGASPC"],"required_evidence":["înregistrarea apelului conform procedurii"],"manual_implication":"119 nu este înlocuit de aprobarea conducerii clubului.","club_action":"Afișează canalul și explică diferența față de 112.","uncertainty":"Datele de contact și programul se reverifică înainte de publicare.","legal_review_required":false,"source_ids":["SRC-0013","SRC-0014"]},
    {"requirement_id":"SAFE-REQ-009","topic":"procedura academiilor","requirement_text":"În procesul FRF de clasificare aplicabil din 2026, academia documentează procedura de safeguarding, responsabilul instruit și listele personalului instruit.","status":"FRF_REQUIREMENT","legal_or_policy_basis":"Decizia FRF din 18.07.2025 și documentele clasificării 2026","issuer":"Federația Română de Fotbal","exact_article_or_section":"comunicat, secțiunea privind procedura de safeguarding; pagina certificare 2026","applies_to":["academii participante la clasificarea FRF 2026"],"effective_date":"2026-01-01","last_verified":"2026-07-30","responsible_role":["conducerea academiei","responsabil safeguarding"],"required_evidence":["procedură","desemnare","diplome","liste"],"manual_implication":"Nu este prezentată drept obligație universală pentru orice club U11.","club_action":"Verifică statutul clubului în procesul FRF înainte de a declara cerința obligatorie.","uncertainty":"Aplicabilitatea în afara academiilor clasificate nu rezultă din comunicatul verificat.","legal_review_required":false,"source_ids":["SRC-0015","SRC-0016"]},